"id";"dg_id";"title";"type";"min_denominator";"level_green";"level_yellow";"level_direction";"short_description";"long_description"
"nger_dg";"";"Dekningsgrad";"andel";10;0,8;0,6;1;"Dekningsgraden angir hvor fullstendig registeret er, det vil si hvor stor andel av de endoskopiske inngrepene utført ved gynekologiske avdelingen i Norge som er registret i NGER.";"For at dataene i registeret skal være nyttige er det avgjørende at dekningsgraden er høy. En god dekningsgrad er en forutsetning for å vurdere kvaliteten ved de endoskopiske inngrepene hos gynekologiske pasienter ved norske sykehus."
"nger_kompl_intra_hys";"nger_dg";"Hysteroskopi: Komplikasjoner under operasjonen";"andel";10;0,02;0,04;0;"Forekomsten av komplikasjoner ved hysteroskopiske inngrep.";"Variabelen omfatter komplikasjoner som inntreffer under inngrepet. Det er definert følgende årsaker til komplikasjonene: tilgang, teknisk, perforasjon, blødning og fluid overload."
"nger_kompl_intra_lap";"nger_dg";"Laparoskopi: Komplikasjoner under operasjonen";"andel";10;0,02;0,04;0;"Forekomsten av komplikasjoner ved gynekologiske laparoskopiske inngrep.";"Variabelen omfatter komplikasjoner som inntreffer under inngrepet. Det er definert komplikasjons årsaker i form av uterusmanipulator, tilgang, hjelpeinnstikk, intraabdominell, teknisk/utstyr og postoperativ. Sistnevnte innebærer komplikasjoner umiddelbart etter avslutning av inngrepet før pasienten er blitt flyttet til postoperativ avdeling."
"nger_kompl_postop_hys";"nger_dg";"Hysteroskopi: Pasientrapporterte komplikasjoner etter operasjon";"andel";10;0,003;0,006;0;"Forekomsten av middels og alvorlige komplikasjoner etter gynekologiske hysteroskopiske inngrep.";"Komplikasjoner etter operasjonen, såkalt postoperative komplikasjoner, deles i 4 kategorier avhengig av alvorlighetsgrad: Lite alvorlig, middels alvorlig, alvorlig og dødelig. De lite alvorlige gir ingen varige men, men en form for behandling er nødvendig. Dette dreier seg gjerne om mindre sårinfeksjoner og urinveisinfeksjoner som ofte behandles i regi av pasientens fastlege.  De middels alvorlige komplikasjonene innebærer behov for reinnleggelse og eventuelt behov reoperasjon, men gir ingen varige men. De alvorlige komplikasjonene er truende for livet eller gir varige men utover et operasjonsarr.  Kvalitetsindikatoren omfatter kun kategoriene middels alvorlig og alvorlig. På samme måte som ved laparoskopi er det infeksjonene som står for det største volumet av postoperative komplikasjoner etter hysteroskopi. Fordelingen videre med blødning og organskade tilsvarer også bildet ved laparoskopi. Det totale omfanget av komplikasjoner ved hysteroskopi er imidlertid betydelig mindre enn ved laparoskopi."
"nger_kompl_postop_lap";"nger_dg";"Laparoskopi: Pasientrapporterte komplikasjoner etter operasjon";"andel";10;0,025;0,05;0;"Forekomsten av middels alvorlige og alvorlige komplikasjoner etter gynekologiske laparoskopiske inngrep.";"Komplikasjoner etter en operasjon, såkalt postoperative komplikasjoner, deles i 4 kategorier avhengig av alvorlighetsgrad: Lite alvorlig, middels alvorlig, alvorlig og dødelig. De lite alvorlige gir ingen varige men, men en form for behandling er nødvendig. Dette dreier seg gjerne om mindre sårinfeksjoner og urinveisinfeksjoner som ofte behandles i regi av pasientens fastlege. De middels alvorlige komplikasjonene innebærer behov for reinnleggelse og eventuelt behov reoperasjon, men gir ingen varige men. De alvorlige komplikasjonene er truende for livet eller gir varige men utover et operasjonsarr. De dødelige komplikasjonene innebærer et dødelig utfall for pasienten. Kvalitetsindikatoren omfatter kun kategoriene middels alvorlig og alvorlig. Det er infeksjonene som står for det største volumet av de postoperative komplikasjonene. Det er spesielt operasjoner der man fjerner livmor som dominerer i denne gruppen. Videre følger komplikasjoner i form av blødning og dernest organskade."
"nger_pasient_tilfredshet";"nger_dg";"Pasienttilfredshet";"andel";10;0,9;0,8;1;"Andel pasienter som har positiv eller svært positiv oppfatning av gynekologisk avdeling.";"NGER bruker spørreskjemaet «Treatment Satisfaction Scale» versjon 2 for å måle pasientens tilfredshet med behandlingen. Grensene for grønt måltall er satt på 90% og 80% for gult måltall."
