"id";"dg_id";"title";"type";"min_denominator";"level_green";"level_yellow";"level_direction";"short_description";"long_description"
"noric_bilde_diag";"noric_dummy_dg";"Bildediagnostikk i venstre hovedstamme";"andel";5;0,4;0;1;"Andel prosedyrer der det er brukt supplerende bildediagnostiske metoder (IVUS / OCT) for å bedømme grad av innsnevring i venstre hovedstamme ved innsetting av stent.";"Europeiske retningslinjer anbefaler bruk av tilleggsundersøkelser for å gi supplerende bildeframstilling i tilknytning til utblokking av venstre hovedstamme. Intrakoronar ultralyd (IVUS) og optical coherence tomography (OCT) er metoder som brukes til dette formål. Pasienter som tidligere har fått utført bypass-operasjon og pasienter som blir behandlet for akutt hjerteinfarkt av typen STEMI er ikke medregnet i analysene.  "
"noric_blodfortynn_med";"noric_dummy_dg";"Foreskriving av blodfortynnende medisiner";"andel";5;0,95;0;1;"Andel pasienter som har fått foreskrevet anbefalte blodfortynnende medisiner etter utblokking av hjertets kransårer med innsetting av stent.";"Blodfortynnende medisiner er viktig for å hindre blodproppdannelse. Europeiske retningslinjer anbefaler samtidig bruk av to blodplatehemmere som hovedregel hos pasienter som har fått satt inn stenter. I visse tilfeller kan en av disse erstattes av andre blodfortynnende medikamenter. Indikatoren viser andel pasienter som har fått foreskrevet anbefalte blodfortynnende medikamenter ved utreise etter utblokking av hjertets kransårer med innsetting av stent. "
"noric_dummy_dg";"";"Dummy dekningsgrad Noric";"";NA;NA;NA;NA;"";""
"noric_dummy_dg_nstemi";"";"Dummy dekningsgrad";"";NA;NA;NA;NA;"Dummy dekningsgrad for indikatorene nstemi_24t og nstemi_72t";"Dummy dekningsgrad for indikatorene nstemi_24t og nstemi_72t. Tre sykehus leverer ikke bra nok på tidsvariabler."
"noric_kolesterolsenk_med";"noric_dummy_dg";"Foreskriving av kolesterolsenkende medisiner";"andel";5;0,9;0;1;"Andel av pasienter som har fått foreskrevet anbefalt kolesterolsenkende behandling med statiner etter utblokking av hjertets kransårer med innsetting av stent.";"Kolesterolsenkende behandling er viktig for å hindre progresjon av kransåresykdom hos pasienter som har fått påvist dette. Europeiske retningslinjer har en sterk anbefaling om kolesterolsenkende behandling, siden dette har vist seg å forhindre hjerteinfarkt og behov for ny utblokking senere. Indikatoren viser andel pasienter som ved utskrivelse har fått foreskrevet anbefalt kolesterolsenkende behandling med statiner etter utblokking av hjertets kransårer med innsetting av stent."
"noric_nstemi_24t";"noric_dummy_dg_nstemi";"Invasiv utredning innen 24 timer ved NSTEMI";"andel";5;0,5;0;1;"Andel pasienter med hjerteinfarkt med mindre EKG-forandringer (NSTEMI), som innen 24 timer etter innleggelse i sykehus ble utredet med røntgen av hjertets kransårer.";"Ved hjerteinfarkt med mindre EKG-forandringer (NSTEMI) er blodåren ofte ikke helt tett, men det er risiko for at den kan bli det. Europeiske retningslinjer anbefaler at pasienter med NSTEMI får utført invasiv utredning med røntgen av hjertets kransårer innen 24 timer etter innleggelse i sykehus, mens en norsk nasjonal kvalitetsindikator anbefaler at dette skjer innen 72 timer. Registeret presenterer data for ventetid innenfor begge disse tidskategoriene. Hvis pasienten overflyttes fra andre sykehus blir tiden fra innleggelse der til utredning lengre, og dette gjør at sykehus med mange overflyttinger får lengre ventetid. I løpet av den tiden registeret har eksistert har det vært en reduksjon i ventetiden ved flere sykehus. Bedringen kan dels tilskrives kvalitetsforbedringsprosjekt og dels økt fokus på kvalitetsindikatoren generelt."
"noric_nstemi_72t";"noric_dummy_dg_nstemi";"Invasiv utredning innen 72 timer ved NSTEMI";"andel";5;0,8;0;1;"Andel pasienter med hjerteinfarkt med mindre EKG-forandringer (NSTEMI), som innen 72 timer etter innleggelse i sykehus ble utredet med røntgen av hjertets kransårer. ";"Ved hjerteinfarkt med mindre EKG-forandringer (NSTEMI) er blodåren ofte ikke helt tett, men det er risiko for at den kan bli det. Europeiske retningslinjer anbefaler at pasienter med NSTEMI får utført invasiv utredning med røntgen av hjertets kransårer innen 24 timer etter innleggelse i sykehus, mens en norsk nasjonal kvalitetsindikator anbefaler at dette skjer innen 72 timer. Registeret presenterer data for ventetid innenfor begge disse tidskategoriene. Hvis pasienten overflyttes fra andre sykehus blir tiden fra innleggelse der til utredning lengre, og dette gjør at sykehus med mange overflyttinger får lengre ventetid. I løpet av den tiden registeret har eksistert har det vært en reduksjon i ventetiden ved flere sykehus. Bedringen kan dels tilskrives kvalitetsforbedringsprosjekt og dels økt fokus på kvalitetsindikatoren generelt."
"noric_pacemaker";"noric_dummy_dg";"Pacemakerbehov etter innsetting av aortaklaff";"andel";5;NA;NA;0;"Andel pasienter som har fått permanent pacemaker under sykehusoppholdet etter kateterbasert innsetting av aortaklaff (TAVI).";"Etter kateterbasert innsetting av aortaklaff (TAVI) kan det oppstå hjerterytmeforstyrrelser som gir behov for permanent pacemaker. Indikatoren angir hvor stor andel av pasientene som etter TAVI har fått operert inn permanent pacemaker under sykehusoppholdet. Lav andel med pacemakerbehov er ønskelig. Ved noen sykehus blir pasientene raskt overflyttet til annet lokalsykehus etter innsetting av hjerteklaff. Dersom behovet for pacemaker melder seg etter overflytting til annet sykehus, vil dette ikke komme fram i datagrunnlaget til registeret og resultatene må tolkes med forsiktighet.  Resultatene viser likevel at det er stor forskjell mellom sykehusene når det gjelder pacemakerbehov. "
"noric_trykk_maaling";"noric_dummy_dg";"Trykkmåling ved innsnevringer i kransårene";"andel";5;0,3;0;1;"Andel prosedyrer der trykkmåling ble utført for å bedømme grad av innsnevring i kransårene hos pasienter med stabil kransåresykdom.";"Bruk av trykkmålinger (FFR og iFR) ved innsnevrede kransårer gir nyttig informasjon for å bedømme om en innsnevring er av betydning for blodstrømmen eller ikke og hvorvidt det bør utføres utblokking av åren eller ei. Europeiske retningslinjer har en sterk anbefaling om bruk av nevnte metoder. Indikatoren viser andel prosedyrer hvor trykkmåling har blitt utført ved kransårerøntgen hos pasienter med stabil angina pectoris. Bruk av trykkmålinger varierer mye mellom sykehusene. "
